{
  "schema_version": 2,
  "manifest_kind": "research_top32_exporter",
  "verification_status": "verified",
  "exporter_git_sha": "06ff8c34417fb7dbc24e41d786dfb6434cdd6aa1",
  "exporter_binary_sha256": "0b26990a153df06c8e870b7e44abca386ada2ffd6f649c0232cea6a79960acbf",
  "sakura_input_head": "8e966dff456e4e7165e025f97c1f73327ff3f550",
  "dictionary_sha256": "6d34364b5354d3c67efefaf15b50142b1365b21140ec8eee0f77570d828544ad",
  "instrumentation_patch_sha256": "fc855aecdec606fe244fd1e3035e0e00ec5cfd6efbc4903ea83b8bf2984bf546",
  "cargo_lock_sha256": "ac5cfc6970c140474175e921f4f7394814ecc17fbfee803172434ab0d3c46f38",
  "rustc_version": "rustc 1.96.0 (ac68faa20 2026-05-25)",
  "cargo_version": "cargo 1.96.0 (30a34c682 2026-05-25)",
  "target_triple": "x86_64-pc-windows-msvc",
  "profile": "release",
  "build_flags": [
    "--remap-path-prefix=<WORKSPACE>=/sakura-input",
    "-C",
    "link-arg=/Brepro"
  ],
  "build_environment": {
    "CARGO_BUILD_TARGET": "x86_64-pc-windows-msvc",
    "CARGO_INCREMENTAL": "0",
    "CARGO_NET_OFFLINE": "true",
    "CARGO_PROFILE_RELEASE_CODEGEN_UNITS": "1",
    "CARGO_PROFILE_RELEASE_DEBUG": "0",
    "CARGO_PROFILE_RELEASE_LTO": "fat",
    "CARGO_PROFILE_RELEASE_OPT_LEVEL": "3",
    "CARGO_PROFILE_RELEASE_PANIC": "abort",
    "CARGO_PROFILE_RELEASE_STRIP": "true",
    "RUSTUP_TOOLCHAIN": "1.96.0-x86_64-pc-windows-msvc",
    "SOURCE_DATE_EPOCH": "0"
  },
  "requested_limit": 32,
  "effective_converter_bound": 32,
  "user_dictionary_enabled": false
}
